<?xml version="1.0" encoding="UTF-8"?>
<Data xmlns="mytimes"
 xmlns:xsi="http://www.w3.org/2001/XMLSchema-instance" 
 xsi:schemaLocation="mytimes http://iphone.anteboth.com/mytimes/xml/mytimes-model.xsd">
    <Project name="name1" description="description1">
        <Task name="name3" description="description3">
            <WorkUnit description="description5" startTime="2006-05-04T18:13:51.0Z" duration="0" pause="0" running="false"
                 chargeable="false"/>
            <WorkUnit description="description7" startTime="2006-05-04T18:13:51.0Z" duration="0" pause="0" running="false"
                 chargeable="false"/>
        </Task>
        <Task name="name5" description="description9">
            <WorkUnit description="description11" startTime="2006-05-04T18:13:51.0Z" duration="0" pause="0" running="false"
                 chargeable="false"/>
            <WorkUnit description="description13" startTime="2006-05-04T18:13:51.0Z" duration="0" pause="0" running="false"
                 chargeable="false"/>
        </Task>
    </Project>
    <Project name="name7" description="description15">
        <Task name="name9" description="description17">
            <WorkUnit description="description19" startTime="2006-05-04T18:13:51.0Z" duration="0" pause="0" running="false"
                 chargeable="false"/>
            <WorkUnit description="description21" startTime="2006-05-04T18:13:51.0Z" duration="0" pause="0" running="false"
                 chargeable="false"/>
        </Task>
        <Task name="name11" description="description23">
            <WorkUnit description="description25" startTime="2006-05-04T18:13:51.0Z" duration="0" pause="0" running="false"
                 chargeable="false"/>
            <WorkUnit description="description27" startTime="2006-05-04T18:13:51.0Z" duration="0" pause="0" running="false"
                 chargeable="false"/>
        </Task>
    </Project>
</Data>
